,reviews
124,"✅ Trip Verified |  Total chaos for departures immigration at Malaga Airport. Boarding was quick, polite welcome by cabin crew. Beverage cart after take off was prompt, followed by lunch with a choice of 3 entrees. Food can best be described as wholesome, but not meeting quality levels of Air France, Swiss or Lufthansa short haul business class meals. Menu is still missing, and like many other aspects of the experience, BA cut a lot during Covid and have not reintroduced. I wouldn't mind, but on European trips in 2022, BA are charging up to 3 times the fare levels of 2019, and the overall value for money is now very poor. The WiFi did not work from start to finish of the flight. Crew said it had worked on the way out and the Captain had contacted London to get it fixed on the return. BA is becoming more and more shambolic, blaming far too much on Covid and it is time they took some responsibility for their failings.
"
125,"Not Verified |  Shout out to the help desk at Heathrow, we arrived to late to make our flight and the lady (with 32 years exp) was great, she had a tough crowd to deal with and was very kind and helpful in getting us a place to stay, food to eat and a flight home the next day."
126,"Not Verified |  I am constantly amazed how British Airways continue to get things wrong - I pretty much though they had covered all those bases and in the last 15 years living in the UK, I have watched their decline with great sadness. My flight to Paris was no exception. Not only was the flight late, overcrowded and not managed at all by disinterested staff - that we sat on the tarmac, full boarded for one hour while we waited for catering to be loaded on (front and then back) left me gobsmacked. As they barely offer any food service anyway (small packet of crisps and an even smaller bottle of water) on a 45 minute flight, I wondered why they thought it was good operational planning to delay a whole plane load of passengers so that 6 people in business class could speedily eat a poor quality meal on the flight to Paris. As it transpired I was over 90 minutes late and missed the meeting I was flying to Paris to attend. Never again."
127,"✅ Trip Verified |  The short haul flights were the best with the crew on the final leg giving the excellent service that we all hope for. We chose out flights very carefully so that we were booked on flights with the Club World Suits not the Ying Yang arrangement that they still offer. At the last minute the aircraft was changed so we had to put up with the ying yang which really should have been pensioned off ages ago! Most business class offer 4 across but this layout still squeezes in 8 across. As we only take one long haul leisure trip a year in Business Class we always lose out on the ""Points game"" but I take exception to having paid in full on a non refundable basis not to be allowed to reserve my seats. The points gained from this trip alone would have allowed us Bronze status but we were not given this status until after the trip when it is useless to us. This status would have allowed us to book the seats 7 days prior to departure, when they were still available, rather than the 24 hours when they were not available. On the long haul return flight I was unable to book a window seat but on boarding after the doors had closed there was a window seat still vacant. I asked if I could move and was told by the FA she would check. Nothing happened but after take-off a passenger was moved from economy to that seat. Judging by the interaction between them I would bet it was someone on Staff Travel. I think it disgraceful that a full fare paying passenger should be treated like this. Take-off was just after 1930 hrs but we were not offered a drinks service before supper but were told we could order a drink that would be delivered on out tray with the meal. Had we done this our meal would have been cold by the time we ate it. In summary would I ever fly with BA again? No, not if I had half a chance of going with another airline. "
128,"✅ Trip Verified |  A very comfortable (new suite) flight with great service and good food. Crew was wonderful New seat is great, except the shoulder strap is very uncomfortable. Entertainment great. Wifi was annoying, cutting off and needing constant reconnecting. Generally a positive experience."
129,"✅ Trip Verified | British Airways is the most terrible airline I’ve dealt with. They have caused our family extreme stress and disappointment - we have tried for a week now to speak to someone as we can’t make the changes online. They hang up on you every time you call them - we have been driven to despair by their treatment of their customers. You can’t check in online, the application sucks so much you’re better off trying to code your own app and it’ll probably work better, every time you try to check in you are taken to a page that says we can’t verify your documents yet the app and website say you’re verified and ready to go. You upgrade and pay for upgrade and it says it’s guaranteed and then when you go to check in which you have to go to the airport for because online won’t work, they give you a different seat than you paid for and a lower class and offer nothing in return.  I hope I never have the misfortune of getting stuck flying with British Airways ever again."
130,✅ Trip Verified |  British Airways is the most terrible airline I’ve ever dealt with. They have caused our family extreme stress and disappointment - we have tried for a week now to speak to someone as we can’t make the changes online. They hang up on you every time you call them - we have been driven to despair by their treatment of their customers. I have no choice but to cancel our chance of a life time trip we’d booked with our 2 18 year old boys as they were flying with another airline and would have been alone in Japan as BA just cancelled our trip and we cannot rebook online as the trip was booked with avios and companion vouchers.
131,"Not Verified |  BA is getting a real bashing on this forum and I thought I'd buck the trend and report a virtually flawless experience of a short hop from EDI to LCY on BA8703 this Monday. Easy check in, decent lounge experience except the very amiable staff were still forced to serve from behind barriers, very clean plane which left on time, ridiculous amount of legroom in 2D (it is a bulkhead seat but with lots more space than 1A or C), reasonable cooked breakfast served by a very attentive and capable CSM and arrived 15 mins earlier than scheduled. What's not to like, which is my overall experience with the vast majority of my BA experiences over the last 25 years. Anyway I thought it would be nice to read a positive review for once."
132,"Not Verified |  New Club Suites are amazing, the only let down is the bed is a little too firm but the pillow was the most comfortable pillow I have ever used. Food was ok as I have had better on BA in the past and I can understand why they put everything on a single tray which is OK. The cabin crew were brilliant but I was surprised that after dinner the crew didn’t once come round with beverages or even bottled water. BA really have a great hard product here and I would suspect the soft product will improve once Covid restrictions become less of an issue. Well done BA."
133,✅ Trip Verified | Very small plane for a busy route. Service was good but food not so. Ran out of a lot and options left were not good. Cabin crew for BA actually really friendly.
134,"✅ Trip Verified |  BA continue to charge a premium for the most disgusting service, provided by people who shouldn't be in customer service, on tired, dirty and cramped aircraft. Out of 11 flights this year, not one has managed to depart or arrive at their destinations on-time. Including having 3 business class tickets cancelled and an alternative in economy being offered, still no refunds 3 months on and had a flight late and missed connection, so BA cancelled the rest of my ticket, leaving me stranded in the US. "
135,"✅ Trip Verified |  Flew back on BA0254 Bridgetown to Heathrow in the old Club Class. A huge disappointment after going out in the new Club Class suites - the end of this awful yin and yang seating can't come soon enough. Even tried to pay BA's extortionate pre-booking rate for our seats - none left to choose even weeks ahead. My wife and I were stuck in the middle 2 seats of 4 - 13E and F. Good job it was an overnighter so we managed to sleep a bit and not have to climb over our neighbours very often. The March film selection so not good. Not particularly friendly FA who insisted face masks must be worn even though BA's policy has changed regarding flying back to a non-mask wearing destination (ie. London). Sort it out BA. Took off 20 minutes late but big tailwind so more than made up the time on a relatively smooth flight. Dinner not to bad but breakfast - fairly dire. My wife's smoked salmon bagel was dreadful. As usual when BA is good, it's really good but when it's bad it's awful. I recommend hesitatingly - come on BA, be great again. We pay a lot for ""premium"" seats."
136,"Not Verified |  The worst budget airline I’ve ever used! Far worse than Ryanair and I refuse to fly with them even though they’re basically free. BA charge about 10x as much as other budgets but have the worst service. Spent an hour checking in because their outdated computers crashed. They left us sat on the plane for over 2 hours because they couldn’t connect to the internet, then left 50% of our luggage behind because they would have had to refund everyone’s flights if they waited another 10 mins for the other luggage trolleys to arrive. It took three days to return it and cost us £100s. Then on return I’ve now been sat here nearly two hours and there’s no sign of our luggage again. I don’t know how a company can be this incompetent but I’ll be pursuing for compensation. I have some free flights from Amex but I won’t be using them because it’s not worth going through this again."
137,"✅ Trip Verified | First, the actual flights are fine and the staff on all 3 flights (ZRH-LHR, GVA-LHR & LHR-ZRH), first 2 in Economy, are absolutely fine, chatty and friendly, they are a credit to the company. The infrastructure however is appalling. ZRH-LHR impossible to check-in online and just 2 staff to check-in everyone for 2 flights resulting in mislabelled luggage and an hour delay to sort this out. GVA-LHR, 2.5hrs late as no-one at LHR to tow the aircraft to the gate. LHR-ZRH, 50mins late due to slow gate staff. Even when you check-in online you have to queue at the airport to get the actual boarding pass! There are more examples, and for this reason, until they sort out their stressed ground staff, it is impossible to recommend this airline. Onboard 10/10, getting to be onboard 1/10."
138,"✅ Trip Verified |  Have not flown economy with BA for years, what a shock! Hard uncomfortable seats, small aged tv screens with limited inflight entertainment. Food and service appalling. 13hr plus flight, no socks, eye shades, ear plug amenity pack. And no antibacterial wipes offered. Wi-Fi advertised but not available on flight. Paid premium money for a budget airline, more akin to Easy Jet, RyanAir or JetStar. My last time travelling with BA after more than 18 years of flying with them. BA you really do need to buck up your service and become the flagship Service you used to be."
139,"✅ Trip Verified |  Flew to Barbados 16 March on BA 255 in the new Club Class suite. A huge improvement on the old yin and yang Club Class which we unfortunately endured on the way back. Comfortable, big TV screen with high quality picture and good headphones, plenty of nooks and crannies for storing small items and very private. Nice friendly FA's (called by my name from the off) and pretty good drinks service with a good dinner served. Once again let down by a poor (at best) choice of movies on the in-flight entertainment system. Thank goodness the latest James Bond movie was showing. Took off and landed on time. Smooth flight. Only one letdown - the usual extortionate fee charged for pre-booking a seat. Come on BA, stop nickel and diming - it spoils what could be a really good Business Class product and after all we already pay quite a bit for the privilege. I recommend with the usual caveats."
140,"Not Verified |  Very poor flight from Cape Town to London. After the chaos of Cape Town Airport passenger handling with incredibly long queues to get through security and then passport control taking nearly two hours in total we arrived at the lounge somewhat frazzled and were very happy to find a quiet area with decent wine and appropriate food choices for a break before boarding the flight. Boarding went well and we were seated and offered a small half full glass of champagne. The captain made an announcement to say that we were all aboard ahead of schedule and that the flight time would be shorter than scheduled but unfortunately this would mean our arrival would be too early to land due to the 6.00 am lifting of the overnight jet ban at Heathrow so we would have to wait on the ground for perhaps half an hour or so. This was no big deal. Then the captain announced that due to IT issues at Heathrow they could get not compile necessary paperwork so we would be delayed for an indefinite period. With the delay of uncertain duration one might have hoped for a further offering of champagne or other beverage in particularly for Business Class but this was not forthcoming. In the event take off was permitted quite soon after. The crew had distributed menus but then did a PA to say that there were changes to each of the main courses. A drinks order was taken for pre dinner drinks, for main course for dinner and choice of wine with dinner. Drinks and nuts were served circa 45 minutes after take off, in my case a small measure of white wine in the bottom of a pleasant and decent sized tumbler and my husband had another half glass of champagne. Dinner arrived on a single tray with a small measure of red wine in the tumbler. The food looked bland, unappetising and tasted the more so. The cheese (two small pieces) were sitting in a greasy pool of vinegary chutney. No top up of the wine was offered (we did ask for a second glass and it was provided on a very individualised basis) and coffee was not served since we had hit some mild turbulence. The flight was some 11 hours in duration and no other snacks or beverages were offered prior to breakfast which was provided separately to each passenger as they showed signs of being awake. Breakfast was slightly more edible than dinner. Coffee or tea were offered by individual mug, orange juice was available on request. Cabin crew were largely absent from the cabin except during the meal services but it must be said that they were extremely pleasant and were suitably responsive to requests for individual items. Come on British Airways you can and need to do better than this if you are to meet customer expectations and compete with other airlines on similar routes. For the cost of a business class ticket passengers are enjoying only additional space and seat comfort (flatbed) as a benefit over an economy ticket at or below 25% of the price paid for the premium cabin. Time was when flying in Business Class was real treat, no longer is this the case."
141,"Not Verified |  Our main complaint is that the limited food served was bland, barely edible, and by far the worst we’ve ever experienced compared to other airlines used in the past. The staff were friendly enough but they were rarely seen between meals. No snacks were offered during the flight. This is so different to every other airline we have used in the past. After 14 hours of flying the breakfast offered was a tiny, cold, stale, Ham and cheese roll and a small plain yoghurt with a couple of Oreos. If ever you decide to fly with them I suggest that you bring your own food. We certainly will on our return flight but will never use British Airways again."
142,"✅ Trip Verified |  Complete and utter chaos at Heathrow, yet again. Surely the CEO, Sean Doyle, must now take responsibility and step aside for the consistent and continuous IT problems that cause flights to be cancelled and delayed. The queue for the First Wing check in at 10am today was over 1 hour, and subsequent flight to Malaga 1.5 hrs late leaving the gate. Updated about the delays 3 times, but strangely not one person apologised or said sorry - BA seems to think this is normal practice nowadays. As Emerald OneWorld, I wish there was an alternative because BA has become intolerable, and this is after flying them for 55 years since BEA/BOAC days."
143,"Not Verified |  Feb 25, 2022. We show up at the airport 3 hours early for our flight to Dublin. we waited in line for 3+ hours to just check in our luggage. After that, we learn our flight is delayed another 3+ hours. We had a connecting flight in London. When trying to go through customs they wouldn't let us through because the boarding of the plane was going to be happening in 30 minutes. They told us to wait in a customer service line that was well over an hour. We then found out we could have gone through customs because the connecting flight from London to Dublin was delayed over an hour. However, by the time we were told this information, the doors were about to close. The next available flight to Dublin was 2/27 late evening. With that being said we were forced to stay the night in London. After talking to a British Airways manager, they informed us that BA would reimburse us for any hotel, flight (to get to Dublin regardless of the airline), clothes (due to them losing our bags), excursions and transportation. Due to this issue, we had to spend multiple days shopping for clothes, lost out on days we had booked to explore the country, had to now buy an extra suitcase for the new clothes we received (went 4 days with lost bags). When we finally got home, we submitted our claims like we were told to do. Within a few days, it's declined. We have asked for a contact # just to talk to somebody, again declined. We tried to reach out via social media and we get passive-aggressive messages.  They refuse to pay me back for the new flight to get to Dublin, transportation to and from the airport in London, the hotel for London, the clothes I had to buy because they lost my bags for 4 days, and the extra luggage fee because of the extra clothes I had to buy. There is no customer support and they are impossible to get a direct response from."
144,"✅ Trip Verified |  British Airways are in the process of upgrading all its 777 fleet to the new Club Suite, but BA59 had the 16-yrs-old, packed-like-sardines Club World product. The lounge at CPT was also bursting at the seams and food orders were so behind that many passengers had left by the time their food arrived. On boarding, we were surprised to find that the menu, amenity kit and bottle of water had already been placed in the storage drawer. We suspect this is another cynical time-saving initiative on the part of BA. Frustratingly, the menu turned out to be incorrect and the replacement dishes were probably the worst we have ever encountered in any business class on any airline. The drinks run was cancelled without any warning on the spurious basis of a passenger with a nut allergy. It's hard to avoid suspicions that cabin crew were being economical with the truth. Apart from a rather turbulent ride, the flight was otherwise uneventful and arrival was slightly ahead of schedule. Baggage handling was, however, atrociously slow."
145,"✅ Trip Verified |  We flew to Funchal, Madeira yesterday. Madeira has no COVID restrictions for entry, yet BA asked us to upload our NHS vaccination passes, before we could check in online. I received an OK about an hour later, but my husband did not, so I couldn’t check in online. We arrive at Heathrow 2 hours before departure and stood in a long queue for check in. There were just 3 desks open for a queue of approx 100 travellers. Then several people went on breaks or disappeared so we were down to one desk open, with the queue barely moving. I went to complain to various BA staff, who said the manager had been told and more people were coming. One blonde lady walked around for ages, shepherding travellers into the queue, before sitting down at a desk. Another man later did likewise, making us wonder why they hadn’t simply worked at the desks from the beginning. All in all we stood in that queue for a good hour, before almost running to the security queue, which thankfully moved quickly. Then we hurriedly bought a sandwich, walked to our departure gate and stood on the bus to the plane. The whole experience was extremely stressful; and took the best part of 2 hours. We did not have time to sit down until we did so on the plane. And completely unnecessary! If we had been able to check in online, this would not have happened. My husband’s vaccination pass is fine, but not required for Madeira. I think it is a systems failure as he received an email yesterday morning saying his pass was not in order, as did I, even though I’d previously been told, I could check in online. Also unnecessary as if BA had staffed the desks properly the queue would have moved. A staff member told us BA had laid off lots of staff during lock down and was now begging them to return, but having been treated badly, they didn’t want to. The flight itself was fine, on time. We were given a bag of crisps and a bottle of water, again fine, nothing praise worthy."
146,"✅ Trip Verified |  Absolutely bad experience with "" British Airways."" I have two bookings with them for the past two years. both were cancelled. The first one, I understand, "" Covid-19"" unexpected. But today I got another surprise. My flight to Antalya in May 2022 was cancelled and no explanation is given. I will definitely not book ever again with them."
147,"Not Verified |  Flew BA LHR-AUS on a 787-9 on the outbound leg and then back on the A350-1000 on the return leg. Seats comfortable. Staff service on the inbound leg was disappointing. Safety briefing was missed on LHR-AUS route. LHR-AUS boarding on time, flight flew out on time, landed on time. AUS-LHR boarding one hour late, left an hour late and landed one hour late too. Food quality on both legs was not fit for human consumption. Wife ordered a veg meal which was served cold on both legs. In flight entertainment on outbound leg was bad - 2/3 screens not working. On return leg worked fine, but this is due to the A350-1000 being brand new. Good quality of sleep on both legs, which was good. Check in at LHR was flawless and without incident. Check in at AUS was rotten. We queued and were number 4 in line and waited for 1 hour for staff to check us in. What was clear is staff quality in Austin is poor, passengers did not appear to have passenger locator form(s) ready / VeriFly app ready and / or vaccine detail ready. Having looked at business and premium economy class on both legs, paying business class and premium economy did not appear worth it. Baggage was received fine at AUS and LHR - the latter took ages on return. If I had the option of another airline - I would not fly BA."
148,Not Verified |  The food was awful. An over night early morning flight started with the offer of a terrible chicken wrap thing. Terrible. Then went to a Traditional Breakfast with disgusting sausage and inedible hash brown's. Such rubbish on BA.
149,"✅ Trip Verified | I really can’t believe they have the audacity to call this First Class. The check in staff at Singapore were abrupt and unhelpful. The official BA lounge in Singapore was closed, so they’re using a cheap generic alternative, which anyone can pay twenty pounds to go in. Suffice to say it was not pleasant. Onboard was like being in the middle of a bad comedy sketch. I can not believe the two stewardess have ever had any first class training. I had to ask for slippers. The first drink took nearly an hour to arrive, despite only having 8 passengers to serve between the two of them. The poor woman sat next to me ordered a wine, which came filled to the brim. I mean it’s First Class, not a student house party. Neither had any knowledge of the wines on the menu. Most of the food was awful. My steak was dry, over cooked and tough, and whichever catering manger signed off on a canapé of soggy mushroom on top of a chunk of polenta should be sacked immediately. I will say, the cheese and port were nice. However the worst thing was the constant galley noise. There was a cart stowage immediately in front of my seat (1K) which they were in and out of all night, and appeared incapable of shutting without slamming. They also seemed to have stored their personal belongings in to the bin immediately above my seat, so we’re in and out of that as well. I will say the seat itself is very well designed, but personally I’m happy in Club and would never do First again."
150,"✅ Trip Verified |  London to Dubai. Family of 6 kids where from 10 down to 6 years old, savvy travelers, been on many holidays so we were excited to be on BA for first time. But disappointment became desperation as we had not eaten anything since Dublin that morning at 7am. We had no time to eat at LHR so thought we'll get something usually around 1 hour into the flight. 3.5 hours after take off they served out food. Food was fine but nothing special, no issues with beverage, no attention to kids as you'd expect from many other airlines, even a kids book would be good. Movies are all outdated and already watched. So overall very medium experience."
