,reviews
411,Flew BA on open-jaw route BRU-LHR-LAX returning one week later SFO-LHR-BRU. BRU-LHR was on an A319 newly refurbished plane. I paid for seating selection weeks before. The day before on-line check-in opened I saw that some seats on the front of the plane became available to economy travellers with no surcharge so I took one of them to deplane as quick as possible (the plane landed a little bit ahead of schedule anyway). LHR-LAX on the A380 was a really nice experience really smooth flight and incredibly quiet upper-deck cabin. Food was not bad as long as you don't expect anything too fancy in economy. There was only one complete meal after take off and a pre- arrival snack before landing. On an 11 hours flight this may seem not enough but passengers are welcome to pick up snacks in the galley during the flight as well as having drinks fixed on demand. Only one negative spot of the flight: the cabin was really cold! SFO-LHR still on the A380 departed a little bit late due to a malfunction of one of the doors but crew kept us informed of the situation. Same nice experience nice crew and so on. LHR-BRU on an A320 departed late after being stuck on tarmac due to high departure rate at Heathrow. Once again the captain kept us informed and managed to catch most of the delay before landing in Brussels. Overall really nice experience but I wish they would not charge as much for seating selection before online check in. As I may be a nervous flyer I need a window seat and don't want to risk seating elsewhere. The four legs cost me more than 130 euros on pre-paid seating which I could take into account when choosing between BA and an another airline that let you choose free of charge when booking your flight. Besides that I won't hesitate to fly BA in the future.
412,Travelled LGW-MCO-LGW route in Business and was really happy. Great check at Check in at LGW then priority security access. The lounge was superb. Seats on 777ER outward were 2J and 2K which were fine but we changed to 11E and 11F for the return as we noticed that on outward these were more enclosed. Flat beds were great Service was exceptional. Both flights left on time and arrived on time. Delta lounge at MCO is a bit dated but served a purpose so cant complain. Was a bit worried about the service reading some of the reviews but was pleasantly surprised. Well done BA.
413,LHR-EZE business class on board B777. Tired old cabin old IFE system. Business class seat layout cramped and uncomfortable with forward and rear facing seats. However cabin crew deserve praise for their excellent attention.
414,Pisa-LGW. Lounge at Pisa is a shared set up and rather nice. Spacious and colourful. Comfortable seats. Much better than hanging around the terminal. We have used it a few times. Plenty of booze. Mediocre snacks. No food. Checked in online. Baggage drop off. No problems. Plane was parked on the tarmac. Had to hike across in hot sun (which made me wish I wasn't going home). This is very annoying - because the whole point over flying BA instead of the three bright white blue and yellow planes of the Irish airline's planes parked next door - is convenience. This has in the past but did not this time include the use of an air-bridge. (More BA cuts I wonder) Plane was a newish A319 - and pushed back to the minute - and left bang on time. All clean and tidy including the wash-rooms. Seats rather old and worn - but we were comfortable in seats 1 a and 1 c. Afternoon tea served on board - nothing exceptional (not a lot one can do with this sort of meal) - but as my wife was driving when we landed I happily drank three Gin and T's. FA's very pleasant and friendly. Even offered me a 4th G&T which I declined. All in all a good experience. (seats could be much better though). Landed ahead of schedule.
415,I flew from Heathrow to Istanbul on BA on their 767 the crew in Club Europe were very accommodating in their service. From start to finish of the flight they ensured that all passengers in Club Europe received the upmost service. Although the 767 is starting to show some age I prefer this version of the Club Europe seats compared to the new configuration which is being rolled out on their Airbuses. At least the seats on the 767 are comfortable & there is plenty of space between the rows compared the the new version which has the same pitch as economy. The catering was good with a great choice of meals to select from the service was speedy and accommodating too with their drinks etc..
416,Flew First from London to Seattle checked in at T5 and escorted to check-in desk and was checked in very quickly security was quick and then through the million dollar door straight into the Concorde Room. Had lunch in the lounge and think our host was just finishing her shift as not that attentive and service improved markedly when other staff took over after our starters. Good selection of food and drinks and a very relaxing start to our flight. Boarding smooth and both of us were escorted to our seats 2E/F which are 2 together in the middle of the cabin. Cabin crew on both sides were excellent and couldn't do enough to make our flight comfortable. Seat very good and food good quality with a wide selection of drinks available. Flight passed very quickly and being first off plane meant we were first at US immigration although there was no queues so through within 5 minutes and our bags were first off. Excellent flight.
417,Flight BA 677 Istanbul to London Heathrow Club Europe a great flight with a wonderful crew in Club Europe excellent service from all members of the crew with updates and a warm welcome by name from them. The meal was very good indeed with a great choice of meals to choose from. Throughout the flight the crew were very professional and quick to serve the meal and to clear away the meal items too. Although a 767 which was showing some signs of age I much prefer this aircraft with the old style Club Europe seats compared to the new Club Europe which has been rolled out by BA and which no one likes. A wonderful flight and great service what more could I ask from a great crew all that I do ask is keep the 767 & go back to the old Club Europe.
418,Manchester to JFK via Heathrow and back. Positive experience although the flight from Manchester to Heathrow was delayed (outside BA control) we were constantly informed about the delays. Attention to detail was excellent. BA upgraded our flights at our request promptly and without any fuss (Silver wedding Anniversary). The flight attendants were excellent and the food (and drinks) was tasty. Some passengers can be somewhat critical about BA but we were more then satisfied with the service.
419,Travelled from Gatwick to Barbados on Boeing 777. Seating very good. As many reviewers mention the screen is small with a limited amount of films. Overall staff very good although one member of staff forget to give bread rolls out with the dinner until asked. The same member of staff also forgot requested drinks. Very good boarding procedure and disembarkment Overall a pleasant flight.
420,BRU-LHR-DFW-SAT. BRU-LHR: Club Europe Smooth check-in with friendly ground crew small but clean lounge with a delicious croissant and coffee greeted by friendly cabin-crew who gave us an excellent service on this small flight starting with hot towels tasting hot breakfast and excellent tea seats are comfortable but narrow for this short flight. LHR-DFW: First class with fast security process Concorde room with online reserved Cabana was again an island of rest and comfort. Clean 777-300 greeted by name flight crew were excellent. Flight and service couldn't be better. Food was good amenity kit contains everything you need on a 10-hours flight slippers and pyjamas were comfortable. Service was private excellent and on request always with a smile asking if everything was alright. Screen in first is still on of the best with a good selection of movies. DFW-SAT: First class customs in Dallas were electronic for ESTA people so 10 minutes after leaving the plane I was waiting for my bags so I could recheck for my last domestic flight! Greeted by friendly crew when boarding old plane AA. We were offered hot towel and glass of champagne. Friendly captain told us after leaving the gate that there was a problem and we did have to taxi to another gate for technical support. After 1 hour (captain had kept us informed) we took off an arrived after a short flight in San Antonio.
421,This was the first time I have flown with BA and I have to say I was very impressed. I flew economy from Brisbane to LHR return. Via Singapore on the outgoing trip and Hong Kong on the return leg. The experience was so much better than on previous flights I had taken with competing airlines. The cabin felt spacious and comfortable even in economy. There was a good range of inflight entertainment and all staff were extremely friendly and helpful. The cost of the flight was a little more expensive than other airlines but having been very satisfied with the service it would not preclude me from booking with them again. Would preference them over other airlines now following that trip along with recommending them to others.
422,IST-LHR the so called business class is a joke and is virtually indistinguishable from economy on any decent airline seats are crammed together and do not recline properly there is no sort of entertainment whatsoever on a four hour flight. Having flown on Turkish Royal Jordanian Emirates and Cathay Pacific in the past couple of months only made the contrast more striking. Never again!
423,A short hop from LCY-ZRH. Nice clean Embraer which was only about 30% full on a Monday afternoon. Off on time landed early decent pasta salad meal and a white wine in flight. Smooth and efficient journey at a very good price.
424,SAT-DFW-LHR-BRU: First First club Europe. SAT-DFW: Nice and smooth check-in with friendly ground crew no lounge but used my priority pass to enter United lounge. Plane delayed for one hour. Boarding smooth greeted by friendly cabin crew captain apologised for the delay. Offered hot towels and champagne and crisps or nuts. Short but nice flight. Landed with a small delay. DFW-LHR: First class lounge in DFW is very basic and far from boarding gate. Boarding again was very smooth with waiting flight crew greeting you by name and guiding to your seat. Champagne was offered before you could take place in your seat. This first class travel was again a more than excellent flight. Also this time there was a technical issue but the captain informed us about every step excused several times for the delay again when landing in London with a delay of more than an hour. Cabin crew gives you the feeling you are the only guest on board giving you private service on demand. LHR-BRU: Club Europe. Concorde room with online reserved Cabana and a tasteful breakfast. Private bathroom with shower gave me a new revival boost. Boarding yes again excellent in all ways short flight. Hot towels decent food and perfect service by a perfect crew.
425,"LGW-Pisa. I wrote a positive experience a few weeks ago - on the LHR route to Pisa. I am pleased to write (wait for it) another positive review. This time it was the ""old"" Club Europe and better in my view. As I said before its a shame BA cannot produce something exceptional rather than ""Very Good"" when it comes to the seat. The lounge was okay - not to crowded. Flight left 10 minutes late. Very nice meal on board. Really tasty and fresh. Nice smoked salmon and so on. A few Gin and T's washed it down. Friendly FA's. Smooth flight. My only gripe we were parked off station on the outer airport - like Ryanair. A small hassle with a walk over the tarmac. Bags were not given priority which was annoying. All in all - a good experience."
426,Excellent experience LHR to HKG. Was a bit apprehensive about their reputation but found the whole trip excellent. Staff were friendly and helpful aircraft was clean and IFE gave a wide choice. Drinks offered half an hour into the flight and meal served within an hour. Would definitely travel with BA again.
427,We flew Premium Economy class from Singapore to London on a 747 carrier. It was a waste of money. The plane looked 100 years old and nothing seemed to work properly. The entertainment system remote control was stuck to its base and it had to be removed with a sharp instrument. The little screen showed a blurred picture so it was not worth watching movies. The crew was nowhere to be seen and they couldn''t be called if you needed something because the call button had been cancelled on all remote controls. At some stage I went to the toilet and went through the kitchen. The crew was there talking and laughing and one of them was sitting reading the paper. Shame on you BA. Never again!
428,LHR-SYD-LHR via Singapore. I hadn't flown BA long-haul for over fifteen years and so given some of the rather negative reviews on this site I approached the experience with trepidation. However I needn't have worried: everything was tip-top from on-line check-in bag drop lounges boarding on-time departure and arrival on both legs and prompt luggage collect. The aircraft both ways was a newish 777-300ER clean and well maintained and while the herring-bone seat configuration does seem a bit weird on both sectors I was in the last row window seat facing backwards with an empty seat next to me so I was able to slip in and out easily enough and didn't have anyone facing me. The seat was a little narrow for business class. but very comfortable with lots of storage space and no shortage of pillows and blankets; the IFE was excellent - screen on the small side but very good definition and audio. Food was simple but very good quality fresh well-presented and lots of it. Very generous with the booze - excellent champagne wines and some fine malt whiskies all served correctly by the wonderfully attentive FAs: old school British middle aged ladies and gentlemen chatty and polite to the point of parody but the twinkle in their eyes tells you that they know it. An excellent experience keep it up BA.
429,LHR-MAD with BA462 on a Boeing 767-300ER. Very full flight but it didn't stop the crew from delivering superb customer service! Drinks and sandwich offered 30 minutes after take off. Second round of drinks offered. Very cheerful crew helpful and friendly. Pilot personally came out to greet passengers on our way out. Very smooth take off. Landing could be better. Would definitely fly with British Airways again!
430,For my annual trip ATH-PHL via any European city (dep 18/3 return 19/4) this time I chose BA because they were the cheapest. This was my first flight on BA to the USA. Soon after my choice I tried to select a seat as far front as possible however I was asked to pay 35 euros for a seat in row. 27. 35 euros and you are almost at the end of the aircraft. In the end BA was more expensive than others. The flight was ok and punctual B777 not really my choice as very noisy staff service - one hostess was excellent another was ignorant and unwilling. Food the usual Penne Rigate. Complained to BA via email however no reply was ever received. For my return flight I was in row 30 same noisy B777 same Penne Rigate and of course a good choice of inflight entertainment. Breakfast with lovely frozen bread roll. Yes frozen or chilled. My next choice will of course not be BA.
431,A short haul from Gatwick to Rome and I had no expectations. Check in was quick and we were on a vintage Boeing 737. All in all very happy. They supplied a decent enough snack. Drinks service was efficient. There was no in- flight entertainment available but we should all be able to cope for 2 hours without surely? Comfortable enough friendly service got there on time and good price. All adds up to a happy traveller.
432,NCL-LHR return. Great alternative to rail travel which is sometimes more expensive. Check-in was a breeze on both sides. New comfortable A320 cabin old ones were really aged. A choice of snack and drink were served with options for alcohol. Delay arriving into Heathrow as usual the airport is really over capacity and limiting BA as an airline. Annoyed that you are no longer able to choose your seat on hand-baggage only fares!
433,Flew from London Heathrow to Rome Fiumicino. Flew the same route last year too and both times it was excellent. This time our flight was operated with an Airbus A320 with slim line seats that looked brand new. These were very comfortable for a short haul flight and the leg room sufficient. In-flight catering was excellent. Coffee was a bit weak but the sandwiches were delicious. This time cheese and ham doorstop with white bread. I expected good things after last years flat bread and was not disappointed. Cabin crew were very friendly and efficient as were the airport staff. Boarding process was fast and efficient and on both flights at arrival and destination the aircraft was at a jet bridge so no need to board a bus. Flights departed and arrived on time. Will definitely fly BA again.
434,LHR-SFO-LHR. Missed out on the A380 and both legs were in a 747-400. Planes were old but well maintained and clean so no complaints there. Outward leg was excellent with good food and great cabin service. On the return leg the lady in front fully reclined her seat immediately after take off and went to sleep leaving me with just about the same cramped space as you have in Economy. Even during meal service cabin crew did nothing to alleviate the situation. Very disappointed with this aspect and also with the breakfast. How many people on this site have complained that they do not want a hard croissant and sweet cereal bar for breakfast. BA are you listening?
435,Heathrow to Bilbao. This is one of BA's new routes (although they used to fly the route years ago on a B757) and we got our return flights for a bargain Â£74. BA's hand luggage only fares to Europe offer very good value and I wonder when they will consider this pricing tier for long haul routes! The A319 flight left from Heathrow Terminal 1 which is closing in June but now looks and feels like a ghost town. There were 3 shops open on the day of our departure and most of it is boarded up. As for the flight we had the usual BA chaotic boarding process but overall an excellent flight even if the new seats are uncomfortable and certainly similar to Ryanair with hardly any space. I appreciate BA's offering of sandwiches on their short haul flights but do wonder whether passengers really need this service nowadays.
436,Club Europe LHR-AMS. The boarding process was a joke we had to take the bus to our aircraft. In the boarding lounge they asked for all Club Europe and Gold and Silver to come forward and board the bus then they let all of the remaining passengers board the bus which made priority boarding a total joke. They should follow the same process when flights land at a remote stand and have a separate bus just for use by Club Europe passengers at least when departing Club Europe passengers would enjoy their priority boarding. I understand there is a need for on time departures but BA really need to ensure that where priority boarding is taking place their Club Passenger receive it.
437,"BA 1321 Newcastle to Heathrow 1/4/15. Check in at Newcastle was as always very fast and efficient. Once on board the cabin crew did a great job of welcoming everyone. A great crew offering old school BA charm at it's best and no small achievement considering the very early departure time. New and very ""compact"" seating which seems to be the new norm for economy class travel on short haul European flights. Flight arrived at T5 not quite on time as I remember but hey ho not at all bad."
438,Flew Gatwick to Kingston 13/3/15 return 27/3/15 big disappointment had to climb over strangers legs to leave seats. Not all options of food available if your at the end of the meal run. Need to pay to sit together separated from my husband who was next to a nice bloke who was happy to move so we could sit together BA did not even try to accommodate us. Not worth the money Virgin far superior from their lounge to the flight. Will never travel BA long haul again be warned don't waste your money.
439,BA1326 Heathrow to Newcastle 22/4/15. Checked in at T5 by an agent who should train some of the others. Very welcoming instantly struck up a conversation with me this person was a credit to the company and a much needed one. The good experience ended there. Punctuality reared it's ugly head once more. I've recorded this repeatedly. Departure was delayed 45 minutes. Not the end of the world but an inconvenience which happens so regularly I can pretty much count on it. It's a shame BA can't address these issues and get flights operating to schedule the majority of the time as other airlines are well able to. Once on board BA is like a tale of two airlines. Some crews are excellent others just lack professionalism and behave rather strangely at times. Possibly this may stem from the two tier or mixed fleet system. But whatever the issue may be crew quality and service is inconsistent. When we landed at Newcastle a crew member announced that the flight was only 30 minutes behind schedule! Well marvellous not in my opinion. Having just flown around the world on another airline which was able to operate twelve out of thirteen flights either on time or ahead of schedule I have to say that I remain generally unimpressed.
440,Hong Kong to London in World. It was on the A380 - first time aboard and must say I was impressed. A much better experience than the Emirates A380. Great mood lighting large windows. Nice to have a number of small cabins on both decks. Friendly service from the crew.
441,April 3 2015 Sydney-LHR. Staff were quite attentive and pleasant throughout both sectors. The cabin looked very new was clean and comfortable. IFE was fine although not as good as CX. I was sitting in window seat facing backwards which was fine. The seat while sitting is comfortable enough although quite narrow. There is little storage and it can be awkward getting in and out of the seat especially when you are on the window. The problem was when the seat was in flat-bed mode. It is so narrow that you cannot turn. The seat buckles in the middle. As well the passenger next to me would slam his table and TV monitor shut throughout the flight and because of the design the seat you feel every movement. To get comfortable I had to put the seat in more of a recline mode in order to sleep which defeats the whole purpose of a flat bed. As well a fold down footstool completes the end of the bed and it wasn't stable. BA are charging a premium for this seat and they squeeze 8 across (compared to 4 for CX). They are making a great deal out of this amount of real estate in the air. It is time for them to deliver an update. The only reason I took this fare was because of the great luggage offering (which I needed on this occasion - 96 kg) and the fact that I was flying back in First for no additional cost which I will post about separately. So while I recommend this airline overall it is more because the service and staff did compensate. Next time I fly business it will be CX again. The seat is a real let down.
442,15th Aug 2014 flight BA0272. Me and my 3 friends flew from SAN to LHR then to IST. Our check in and baggage processes took almost 2 hours to be completed. I wonder what would happen if we were not been there 5 hours before our flight. When they gave us our tickets we saw that they put us all separately. They could not even manage to sit us together. When I was thinking how could this get worse we missed our LHR-IST flight and waited in a queue for 3 hours to go to our hotel. While a clerk was trying to complete our check-in for 2 hours another clerk next to her managed to complete half of the passengers processes and when we were boarding the plane we learnt that the plane was overbooked and the other cl erk was offering 800 dollars per person and free accommodation for volunteer passengers to fly on the next plane.
443,April 15 LHR-Sydney (via Singapore). I flew First as part of a promotion for no additional cost with purchase of business seat on SYD-LHR leg. I really enjoyed the Concorde Room at Terminal 5 lovely meal great service and very elegant space. In terms of the flight the FA were very friendly and helpful on all legs. They went out of their way to make you feel special and a guest. Food was very good as was wine offering. Seat was comfortable and roomy although there is a lot less storage then in CX Business Seat. In fact while there is a lot of room much of it really is not that useful. At night FA did disappear for much of the time and didn't really come around (except once) to offer water/juice. Whereas on SQ economy FA would check on you regularly throughout flight. While of course it is very special to fly First next time I would be just as happy to fly CX Business which I think is really great value for money and the seats are just as or maybe even more comfortable. If I had paid full fare for this flight I think I would have been questioning the value for money.
444,BA662 31st March. BA662 14th April. BA makes us think 'better quality'. However the flight to and from Cyprus is now disappointing in terms of food offered. The duration is over 4 hours and it is not acceptable for them to offer 2 cold sandwiches.
