,reviews
266,"✅ Trip Verified |  Gatwick to Mauritius. My wife and 2 friends booked and paid £56 each to select our seats with additional legroom adjacent to the bassinet stowage. On boarding the flight the configuration of the aircraft differed, meaning we had the same seat row and number but without the additional legroom. My formal complaint to BA has been met with what can only be described as condescending platitudes and a blank refusal to refund our seat booking fee. We feel that this a scam and are continuing to pursue the matter. Trading standards are also being informed. It didn’t help the aircraft was delayed by 4 hours on the outward leg, was filthy dirty. The return flight had numerous IFE defects and my seat recline did not work. I also noted a number of cabin minor airworthiness issues, (I am a licensed engineer). A marketing email in celebration of 100 years of service has thanked me for flying hundreds of thousands of miles with BA and then rips me off with nothing in return. British Airways you are a disgrace, get your act together and provide the service you were once famed for."
267,"Not Verified |  Flew out of Heathrow on 22nd Feb to New York, 20 mins into our flight and we noticed our Tv's weren't working (4 travellers) but I have to say the cabin crew managed to reset them and they we were working within the hour. The reason for reviewing this is how wonderful the crew were. The crew on this flight were amazing, nothing was too much trouble. Thank you to all involved on that flight."
268,"✅ Trip Verified |  Horrible flight BA from Gatwick to Cape Town and Iberia on the return. I am only 5'2"" 8st 10 and I find the leg room too cramp. The onboard flight entertainment system was down on the BA flight most of the time. It was probably in the last 2 hours of the flight before they managed to fix it and the system was old fashioned and movies were streamed on a loop. The food was barely edible. Coming back on Iberia the entertainment system was better and the food was also better but the seats legroom was just as bad. I was almost bumped off my connecting flight at MAD due to the lockers being filled up. I had another connection to make at LHR and I was not going to miss that so I had to insist they let me on though loads of other passengers were led off. This was the worst flight I have flown on. Last long haul BA flight for me."
269,"✅ Trip Verified |  New York to Venice via London. Staff have been nice when around but aircraft, food, assistance and information all deplorable. Booked Business class. First flight, overnight from JFK to Heathrow - quick, mediocre food service then gone. Chair is set up so I’m staring at a stranger, it’s uncomfortable and difficult to maneuver with no instructions. Didn’t wake me for breakfast, not sure why they had me fill in a form for when I wanted to be woken up. No instructions for the transition between BA flights. Now I’m on the flight from Heathrow to Venice, no offer of coffee, water but worse, business class is just coach class, no extra leg room, just 3 seats with the middle one blocked out. Person in front of me put their seat back and my knees are in my chest. I didn’t pay for international business class to get stuck in uncomfortable seats for 2 long flights. I won’t fly BA again. "
270,"✅ Trip Verified |  Chicago to London Heathrow. Club Class on British Airways is without doubt the worst in the airline industry.  It is bad enough that BA persist using out of date airplanes, circa 25 year old B747-400's, but they perpetuate the dreadful ying/yang seating arrangement of Club Class, where you have to look directly at the passenger next to you, and raise a screen for privacy. Then, mid-flight the crew lower the screen to serve the food. To leave the seat, one has to climb over the legs of a sleeping passenger;~no mean feat in the dark. The crew from Chicago were appalling, and dumped the food upon us as quickly as possible. Breakfast was inedible, and I returned it uneaten. The lounge at O'Hare was a crowded, tiny, dirty facility, with a food bar including some wilted vegetables and crackers with cheese. Insufficient chairs, and a single, old TV. Does no one at BA care how BAD they have become for premium class passengers."
271,"✅ Trip Verified |  London to Chicago. Could it get any worse? The flight to Chicago was equipped with the usual ancient Boeing 747-400. The British Airways First Class product doesn't come up to modern Business Class standards. This particular flight was late again, and the food / wine was simply awful. There is nothing remotely elegant about BA First Class, and the crew demonstrate no sophistication. This experience was like dining at your worst restaurant chain. Finally, not only is the aircraft tired and worn out, but the in flight so-called entertainment system did not work, and had to be rebooted twice. The First Class seat is a bad joke, and extraordinarily uncomfortable. British Airways are at least twenty years out of date with their entire First Class product. All that can be said about this airline is woeful. The Concorde First Class lounge at Heathrow is filthy dirty, and desperately needs refurbishment."
272,"✅ Trip Verified |  Prague to London Heathrow. Very disappointing service. Cabin crew only managed to offer drinks to half the cabin, on a two hour flight that was already delayed - payment machine was broken, staff ran backwards and forwards as nothing seemed available on the trolley. On the bright said, I did save by not having to pay the over inflated prices."
273,"✅ Trip Verified |  London City to Florence. My flight was at around 7am in the morning. Not only it got canceled 3 hours before but at the moment there was no phone line open to call and manage a rebooking. On their site I had the option to reschedule my flight but I couldn’t select any flights on the same day. Interestingly i was able to find & book another one through Skyscanner again with BA at the day of my initial flight with £100 more, of course. Why couldn’t they simple show me this flight on the reschedule page? "
274,"✅ Trip Verified |  London to Johannesburg. Since the aircraft was half full, I was looking for a great flight. We left on time, and that was the only positive point. I started watching a movie, and a young flight attendant  approached and asked for my dinner choice. I told her that I would love a G&T to start with, and then I will read the menu. She told me that this was a late evening departure (9pm is not late for me) and that no pre-dinner drinks would be served. I insisted (this is business class after all, half full flight). 30 minutes later, she brought a tray with everything on it (G&T, first dish, main dish, and dessert).  Never was I offered wine or coffee. The lights were turned off, and I did not see a flight attendant until 1:30 hours before landing.  Other passengers in business where treated the same and complained."
275,"✅ Trip Verified |  Doha to London Heathrow. Flight on time, not completely full, had an aisle seat near back of plane without the entertainment box in the way. Some reviews say that the last few windows are blanked off at rear of the aircraft but not so on this plane. Breakfast was served which was OK. Cabin crew mixed, mostly young and worked quickly. Crew uniform still looks a bit tatty compared with rivals in this part of the world. There is good and bad still with BA - bad was the so called chicken wrap served just before arrival - leathery and inedible - why do they let themselves down with such a poor offering - hardly any passengers near me could eat it. Bad was that there was an old tissue and food wrapper in my seat pocket. Good was the newer aircraft and the breakfast has improved. Arrived on time at Heathrow but to a remote stand."
276,"✅ Trip Verified |  Miami to Tel Aviv via London. At Miami airport on October 2018 what a pleasure was dealing with the agent, so professional, nice and helpful to the every last detail. Now on February 2019 calling British Airways to redeem my Avios what another pleasure dealing with a patient, knowledgeable and nice agent. She explained everything in such detail. You are doing great with such fantastic employees. "
277,"✅ Trip Verified |  London to Seoul. I normally fly business but this was a last minute flight and the cost of Club was prohibitive and so I thought I would give World Traveller Plus a go. The cabin is stylish and intimate and I was surprised how roomy and comfortable the seats were. The entertainment system was working well (although the adverts before every single showing are very annoying). I was happy with the headphones and small amenity kit and felt the staff were very welcoming. My only complaint was the slightly pointless menu we were given as for lunch neither of the meals listed were actually available. A similar thing happened with breakfast, three options, the third being the most appetizing, and no, it hadn't been loaded, so this is an area BA might want to look into. All in all the service was good and worth the price. For ground service BA, please at least keep a couple of desks for people to check into before automation puts us all out of work."
278,"✅ Trip Verified |  London Heathrow to New York JFK. Bag drop did not go well. Lounge (galleries north ) was good and not crowded. Boarding was fine, small delay, well organised. Pre take off drink was better than the one i got in club world 2 weeks previous. Main meal good, pre flight snack was average but my son really liked it. On time arrival, a good flight. Cabin crew included some of the older staff who are not mixed fleet crew and it stands out a mile. I thought this was a good flight."
279,"✅ Trip Verified | San Diego to London. From the moment that I boarded this flight (due to take off at 19.25), the crew had one interest and one only - to get the cabin lights off, which they duly achieved two hours later. As a consequence, the service was negligent in the extreme. This was a Club World ticket - so expensive and I looked forward to a decent level of service. However, I wasn't offered champagne on boarding, wine with my meal or coffee and port after my meal. I complained to BA when I got home but they weren't interested and I was met with a barrage of corporate platitudes. This flight was a disappointing end to what had been a great trip to the US & Mexico and has left me with a very poor view of the airline."
280,"✅ Trip Verified |  Gatwick to St Lucia. Flew BA new revamped business class today and a huge improvement on the old set up. Well lit cabin, improved seating comfort, better and operational entertainment system (always hit or miss before) and decent food. Cabin crew worked hard and were pleasant. I have observed along with everyone else the falling standards at BA and have moved most of my travel to rival airlines but on the basis of today’s experience I will consider them in the future. Much improved, well done."
281,✅ Trip Verified |  London to Chennai. It was amazing. The crew were very friendly. The food was amazing and the seats were comfortable. T was overall an amazing flight and I enjoyed it thoroughly.
282,"Not Verified |  London to Tampa. BA broke my suitcase and I did not make a fuss, I just got a new one. The new one was too large for the overhead bin on the return flight (the only suitcase I could purchase while abroad). So on top of the new suitcase, I had to actually pay BA to check the new bag. Cost me over $100 for their mistake. They also shovel off customer service to some company abroad. You will get an email a month later saying ""I'd like to know you that we are unable to offer refund"". Make a big fuss at the airport if they break your stuff so that you can avoid this black hole they call customer service.
"
283,"✅ Trip Verified |  My husband and I flew on British Airways flight BA-228 from Baltimore to London Heathrow leaving on the 12th February 2019. Every aspect of the flight was poorer than what budget airlines have to offer. The plane was shabby and dated. The seat reclining facility did not operate properly, was not that comfortable, and we had less legroom than the equivalent with budget airlines. The touch screen TV monitor was not working properly. One ear bud on the headphones did not work. The audio socket was too loose for the headphones so the plug kept falling out making it difficult to enjoy the in-flight entertainment (which in itself had a dated choice). The pillow was disgusting and kept falling out of the flimsy cover. The air conditioning lacked consistency alternating between very hot and very cold air. The restroom occupied sign always lit up as vacant even if it was occupied. However what made the flight very unpleasant was the bad attitude of the cabin crew. They were abrupt, unfriendly and quite clearly did not want to be there. There was one exception, an extremely pleasant older crew member who greeted us on and off the flight. There did not appear to be any organisation or smooth co-ordination when distributing the meals. Our two trays of food where placed on top of each other and practically thrown at us by a sour faced crew member. This flight was one hour late making us nervous about catching our connecting flight. There was no information or instructions given to us about connecting flight gate numbers before we landed. Unlike all the other airlines that I have travelled with there were no staff member greeting the connecting customers to point them in the right direction or re-assure them. British Airways would be my last choice of an airline to travel with and I would only fly with them again if there was no other option."
284,"✅ Trip Verified |  Bridgetown to Gatwick. I couldn't imagine that first class on BA would be the same as travelling in business class with for example Qatar, Emirates, Etihad, Singapore, Thai etc for double the price. Cabin, seats and food equals business class. One of the red wines on the wine list was out from start when I left London outbound. Cabin crew worked well and gave splendid service. But first class on BA is not worth the fare. When I complained to customer service after I got home, all I got was they are in the process of upgrading world traveller. "
285,"✅ Trip Verified |  London to Athens. Classic BA love and hate relationship where one flight is perfect and another one is a total disaster. Problems in December 2018 at Heathrow check-in when BA check-in and baggage management IT systems went down for at least 90 minutes. Total chaos with people like myself arrived at the airport 2:30 hours before the flight and queuing while others arriving 45 minutes prior to their departure and given priority. Even though we were checked in at some point, the flight was delayed by 2+ hours on top of the problems. Then flight does not have enough food onboard. At least the crew clearly attempted to reduce flight time to the minimum."
286,"✅ Trip Verified |  I booked a British Airways flight from Amsterdam to London Heathrow. In the beginning everything went normal and smooth. Check-in and boarding was easy and on time and once everyone boarded the problems started one after another. First an announcement was made by the pilot about a flight delay due to strong winds in Heathrow (fair enough). Afterwards the wind problem was resolved but a passenger decided to leave so they had to take out his luggage. After that we received a 3rd announcement stating there is a computer malfunction at Schiphol Airport and they are doing their best to resolve it. This caused us already about 45-60 mins delay but me and other passenger still remained calm and relaxed and then the hell started. We received permission to take off after 7 mins and then the pilot offered passengers who do not wish to travel to leave the plane. Of course there were many passengers who were travelling on business and I guess too delayed to make it on time for their meetings so they decided to leave. The crew warned them that this might cause terrible delay and problems for the other passengers but they still decided to leave. So a group of passengers left and we missed our opportunity to take off. Then the pilot announced that we can take off after 2,5 or 3 hours. The flight was full of overseas travellers. We spent 2 hours sitting in a plane which was not moving anywhere, people unboarded the plane 4 times in total and no food or water was offered to us. We had to line up next to the bathroom to purchase food and drinks and pay for it. The overall experience was terrible and it ruined the whole plan for my first day in London."
287,"✅ Trip Verified |  Flying premium economy on British Airways from New Orleans to London was an absolute pleasure. The nine hour flight was an amazing experience, with great legroom, reclining seat for a nice sleep and low noise. Definitely recommend and will be flying premium on long haul again."
288,"✅ Trip Verified |  Tokyo to London. I was looking forward to this flight because of the Club World ticket and because it was my first time flying on a Boeing 787. We had a good check-in experience, breezed through the airport and enjoyed the JAL Lounge at Narita. We boarded on time and first impressions of the Boeing 787 were good: a modern plane with nice mood lighting as we boarded. The food and wines were really good. I had a beautifully-presented Japanese starter followed by a bento-style lunch as a final reminder of the holiday and my wife chose the western options. There was plenty of choice on the IFE and there was a big screen. On the downside, the cabin was too hot which made it difficult to sleep on the flight. This was a problem that we encountered on our outbound journey too. The seat was comfortable and reclined fully but I find the layout of BA Club World a little awkward because you have to step over another passenger's footrest to access the aisle. The cabin crew were efficient but seemed a bit exhausted and could have been more friendly and welcoming. The context to this review is that we spoiled ourselves and flew in first class on the way to Tokyo. We had an amazing experience with such comfortable seats and exemplary service from the cabin crew. We both felt a bit disappointed with the return flight in comparison and felt there was room for improvement, but at the same time our expectations might have been too high because of the previous flight."
289,✅ Trip Verified |  London to Tokyo Haneda. My wife and I treated ourselves to first class flights for our holiday to Japan with the help of my Avios and a BA Amex companion voucher. We were very excited about flying first class and the dedicated check-in area at Heathrow was great. We boarded on time and the cabin did not disappoint. We had very grand seats with lovely surroundings. The cabin staff who looked after us were fantastic and really took the time to get to know us and understand what we wanted. The food and alcoholic drinks were great. I went for beef main course followed by the amazing chocolate and toffee pudding. I was ready to sleep after all that food but saw that there was lots of choice and a large screen for the IFE. My wife and I both said afterwards that it didn't feel like a long-haul flight because the time passed so quickly and comfortably. My only complaint is that the cabin was uncomfortably hot while we were cruising which made it harder to sleep.
290,"✅ Trip Verified |  I was flying London to Billund today via British Airways and I was a bit hesitant as I’ve never flown with this airline, due to early morning traffic I was running a little behind schedule and I had a 23kg bag to also check in and check in closed 45 mins before my flight departs. Upon arrival I was greeted my a young gentlemen who was very helpful and respectful. He calmed me down and reassured me that everything was going to be okay ,as I was very very stressed thinking I was going to miss my flight. He then offered to give me fast track through security so I could get to my gate quicker. I just want to thank him again as he made my experience with British Airways like no other and I’m very grateful."
291,"✅ Trip Verified |  San Diego to Frankfurt via London. It all started when trying to check in online 24h before departure from San Diego to Heathrow. On long flights like this I always reserve an aisle seat. Online Check-in did not work, no reason was given. Ok, let’s call US hotline. I tried at least 40 times. Answers were either, that call could not be completed, check number or due to heavy call volume they could not process call right now. I did not make it through. As an act of desperation I today called a British number. The lady told me guess what: no more aisle seats available. Some other numbers I tried were available on weekdays only, good to know if you need help on a Sunday. So I‘ve got the strong feeling, that they do not even care about there customers. B On my flight to San Diego 5 days ago, my TV screen was gone and there was no way to change seats. Great overall experience."
292,✅ Trip Verified | Flown with British Airways on numerous occasions with no issues. However on this occasion my baggage was lost on arrival at Gatwick. There was no British airways representative at the baggage claim however there was a phone that allowed me to call the baggage department. Reclaiming lost baggage was simple and my bag was put on the next flight to Singapore which I received the following day.
293,"✅ Trip Verified | Flying last Sunday from Geneva to Piladelphia via London in business class. When I arrived at the boarding gate in London to take my flight to Philadelphia they told me that there was no sufficient business seat available! They overbooked! My choice was then either to fly ecenomy or to take the next flight! They just did not care about their customer. No phone call, no email, no indication at the lounge nothing until I was at the boarding gate. I kindly accepted to take the next flight. The plane was delayed by 1 hour due to technical issues. When I arrived at Philadelphia, no suitcase! No British Airways desk on arrival, it was late no one could help. I finally retrieve my suitcase 3 days later: broken! During these 3 days, it was impossible to get someone on the phone. On my flight back to Geneva, same issue! no sufficient business class seats available. It is clear that this company just don't care about their customers, they just care about their money !"
294,✅ Trip Verified |  London Heathrow to Paris CDG. Quick and easy flight to Paris. Took just 40 minutes to reach CDG. Everything went well and the cabin was very clean. The only complaint was boarding which too way too long and was very unorganized.
295,"✅ Trip Verified |  Johannesburg to London. At Johannesburg used BA galleries lounge which was fine if a little busy. Plane boarded on time, very hot due to lack of auxiliary power unit, given aircraft at JNB all day, perhaps this could have been addressed. After take off the crew dispensed with pre dinner drinks and went straight for meal. Portions of starter very small, I was given someone else’s by mistake which was then taken away and given to him. I thought that originally the idea of the new Club World meal involved a trolley service but no sign of that. Main was good (beef), dessert was cheese, very small basic selection. Then bed, gap in seat made lie flat less comfortable. Breakfast was ok. Delay with baggage due to another aircraft technical issue (there seemed to be a few of these). Arrivals lounge was good. Overall an average experience."
296,"✅ Trip Verified | Edinburgh to Bangalore via Heathrow. Rude staff, poor service, missing baggage, poor entertainment system. I spilled my drink and the attitude of the staff was brutal. I apologised for my clumsiness, but I was made to feel like I had deliberately done some shameful act in public and staff would not want to have anything to do with me. I asked for tissues and the answer was, get it from the toilet. The staff did not even have the courtesy to ask me if I needed another drink once I cleaned myself up. The crew were also extremely noisy. Chatting and laughing loudly at the pantry place for the entire duration. And then - while boarding at Edinburgh, they offered to check in my second bag for free because cabin was full. The staff wrote Bangalore via Heathrow, but my bag was not loaded to connecting flight. 4 hours gap mind you. "
297,"✅ Trip Verified |  
Berlin to Johannesburg via London. The short haul flight between Berlin and London was oKay, they don't include drinks or snacks anymore on short distance flights and prices onboard for them are compared to some low-cost carriers high. Because of an engine problem, the flights from LHR to JNB was delayed by 2:45h. British Airways gave £5 vouchers out to compensate for snacks and drinks. Inside the A380, the IFE boxes under the window seats take a big part of the available leg space."
298,✅ Trip Verified | New York JFK to London Heathrow with British Airways. An extremely average flight. Nothing stood out as good and nothing stood out as bad. The flight was smooth and felt quite short. The cabin crew was helpful and everything was comfortable. The inflight entertainment needed some work.
