,reviews
0,"Not Verified |   Had to cancel my flight months in advance due to a change of schedule. I was flying with American Airlines and British Airways. Selected seats and when I attempted to get a refund on the selected seats, AA refunded me with no issue when BA refused despite both companies having similar policies. Avoid them, fly with anyone else. Customer service is a joke, taking over 2 weeks to respond to my email and giving me no further justification than what I was told on the phone."
1,"✅ Trip Verified | Flight cancelled with no reason given less than 24 h before departure. The earliest offered replacement on their (terrible to use) app was 3 days later, which was unacceptable. Their phone lines do not work and would reject your call due to being overwhelmed. Even submitting a claim on their website is frustrating due to their terrible interface. Overall, terrible company with wholly inadequate customer service."
2,"✅ Trip Verified | This is a route I fly regularly. Used first class security and lounge all good. Lounge surprisingly not so busy. Was great to see we weren't departing from the dreaded A10 bus gate, and the flight was on time. Boarded and ready to go on time and then.... Six passengers were a no show. A 50 minute delay to offload the bags and depart, longer than the actual flight itself. There has to be a better process for fast tracking this. Hence finally arrived in Paris 45 mins late. On the plus side the cabin crew were great and even had a personal welcome from the inflight manager which happens less and less these days."
3,"✅ Trip Verified |  While BA may have made some positive improvements to its Club World product, its World Traveler product and catering leaves much to be desired. The first meal service was very slow, more than 3 hours to serve the meal. The portions were incredibly small - the chicken dish contained maybe 5 pieces of chicken, 2 pieces of broccoli, and a piece of unknown food. Small snacks were available during the flight, but the real let down was the snack before landing in Vancouver. It was a bizarre tasting chicken pastry wrap, which didn't have much chicken and did not taste at all like a pastry. It was too sweet, too mushy, and too salty. The seats, although not exactly spacious, were tolerable, although the aisles are very narrow, and cabin crew and other passengers frequently bumped into me while walking up and down the aisles. Cabin crew were generally responsive to passengers' request, and once or twice during the flight, came down the aisles with drinks. However, the poor level of catering made for a very frustrating trip. I certainly cannot recommend BA."
4,"✅ Trip Verified | British Airways new Club Suite is a marked improvement from their older Club World seats. The new Club Suite offers a fair amount of privacy, especially with the screen door closed, and includes direct aisle access. When fully reclined, the seat converts into a fairly spacious bed, although I found the surface on the side a bit hard and uncomfortable to sleep on. The catering on board was fairly good and tasty - the appetizers and the main course were generally well cooked, although the cabin crew were very slow with the meal service. It took almost 3 hours after departure from Vancouver for the meal service to be completed. Prior to arrival, a light breakfast was served, which contained a croissant, a small egg and bacon sandwich, and a mango puree. BA's catering on this flight was generally good. Unfortunately, upon arrival at Heathrow, passengers had to wait over 90 minutes for checked baggage to arrive. No explanation was given, and not a single member of ground staff came to assist passengers or provide any information about when checked baggage would arrive. This was a very frustrating end to what was otherwise a fairly enjoyable trip in Club World, and left a very poor last impression of BA."
5,"✅ Trip Verified |  Four very pleasant, on time flights with friendly, helpful staff. The guy on the LHR/SFO leg was exceptional and I regret that I have forgotten his name. Only negative was the food on the SFO/LHR leg. The advertised filet steak was more akin to stewing steak and was inedible. Sadly this is not the only occasion I have food on US/UK flights to be sub standard. Otherwise happy to recommend BA."
6,"Not Verified |   We travel extensively over 25 years and tend to use BA on our regular trips where possible and in recent years we have had overall good service from them however more recently we have experienced flight delays, operational issues, flight cancellations, poor check-in experiences etc. On our last two recent trips, one to Zurich and another to Iceland they had cancelled our return flight an hour or so prior to the scheduled departure time despite the flight showing as on time and no problems being reported. We have just returned from Iceland and our experience was one of the worst we have ever had with BA. Again our flight was just cancelled due to operational reasons but what made matters worse on this occasion was the flight was quite early at 7:45am. We went to bed at around 11pm (night before), checked the flight and it showed as being on time with again no issues being reported so we went to sleep fairly rest assured the the flight would be fine. We woke up at 5:30am and then discovered our flight had been cancelled without any warning! We were then left with virtually no other return flight options for that day. It soon got worse as the earliest flight option then being offered by BA was 3 days later! We opted to choose Tuesday with BA as we were left with no other option! If we hadn't acted quickly the Tuesday availability was sure to sell out leaving us with a return option of Wednesday onwards having experienced the same problem with BA in Zurich back in December. We were lucky on this occasion as BA offered several flights back on the same day in Zurich but this wasn't the case with Iceland! We were then left in a right predicament as hotel availability in Iceland was very limited to non existent given the very short notice of our cancelled flight. Our hotel was fully booked and our hire car had to be returned to the airport. From a logistical point of view this was a complete nightmare having to then rebook another hire car and to find alternative hotels. We then decided to search for any in-direct flights online to get us back to the UK sooner with another airline and after a good half hour of searching we came across an in-direct flight into Gatwick with Norwegian Air but it went via Oslo and a total journey time of 8 hours! This was not ideal as our car was in Heathrow! Assessing our options which were virtually none, we had no guarantees that the flight with BA on Tuesday would also have proceeded on time and checking with Norwegian Air both flights were on time and looked promising so we decided to get these booked at an additional expense of £600! If we had stayed in Iceland we would have also incurred additional cost to then fight back with BA or the insurance company. Our priority was to return home ASAP as we had important work and personal commitments on the Monday so we had to return ASAP. We eventually flew back fine with Norwegian Air and the service we received was far superior to that of BA. The boarding process was slick on both flights compared to a complete shambles with BA. Norwegian Air offered a full food trolley service with soft drinks, tea's and also a range of alcoholic drinks. Compare this to just the water and snack bar on BA!! Both flights were on time and we eventually landed in Gatwick shortly after our expected arrival time. We got back very late home after having to then book a hire car at Gatwick and in the morning we contacted BA to cancel our alternative Tuesday flight "
7,"✅ Trip Verified |  Flight delayed an hour due to bad weather around JFK however this was made up during the flight, only to be delayed again by weather over LHR. Spending an extra hour in the American/BA lounge at JFK was not ideal. Cold environment, cold staff, indifferent to the travellers needs. One area was exceptionally dirty with plates on the tables and napkins strewn on the floor. Waited for a drink as no one to serve. Played a game of find the chips/crisps - which were hidden on a table in a dark corner in one of the 3 areas. This is a crazy expensive route in Business Class and it feels like a rip off across all the airlines however the quality of BA's business class has much improved with the introduction of the suites. The privacy is a big improvement as too is the seat comfort and I managed a good 3hr sleep on the overnight red-eye flight. Food service was very efficient for those that wanted it and did the trick so late at night. Aside from getting a decent rest on the relatively short flight the other highlight was the flight attendant. Unfortunately, I didn't catch his name but he was superb, being responsive to the few requests I made and remembered my name throughout the flight. A small but very valued touch that is often missing with business class flight attendants on BA. Very good experience all round except the price which is reflected in my value for money rating."
8,✅ Trip Verified |  A very full flight made Premium Economy feel a little less premium than you should expect for the price however the smaller cabin configuration and slightly roomier seating made the journey relaxing enough. Catering was pretty good and the inflight service was efficient and friendly. Arrived on time and no delays with baggage delivery. No complaints as PE served it's function for the relatively short 7.5hr flight.
9,"✅ Trip Verified | The worst airline I’ve ever flown. Could not check in until my flight was open (I was there 2 hours before flight not 2 days before!). Asked if my husband could fly on the same flight (he was also flying club Europe but on a later flight and I could see online that there was room on the plane I was on). The agent said they couldn’t change his flight at the ticket counter (never heard of that). This could only be done online or by calling British Airways. I had already tried online so asked for a telephone number to call and the British Airways agent did not have a number for me to call. So I looked up and called several numbers online and all I got was the office was closed on Saturdays. I asked for the ticket agent again. Explained we were going to his mother’s memorial and that and it would be nice if he could get on the same flight as I was on. They still refused to help. So, he stayed on his flight which was leaving 4 hours later and then got cancelled and he had to spend the night in Florence. They re routed him on a flight to London via Edinburgh. And then they lost his suitcase!! You can’t make this stuff up! As for my flight # BA 525, I got several emails and messages advising me it was delayed. I decided to go to the gate at the original flight time and guess what? It was boarding on time. I can’t imagine the number of people who might of missed it. It’s just an awful, awful airline and I will never fly them again if I can possibly avoid them!"
10,"✅ Trip Verified |  I am surprised to be able to give a favourable review of the flight. European Business Class is typically 3x3 seating with the middle seat on each group of three left empty. Leg room is never generous and BA is at the bottom of the generous barrel in this respect. However, on this occasion at least and as the flight is one hour that was not an issue. Cabin crew were great, very professional and efficient, cabin was clean and aircraft seemed pretty up to date. I was surprised to find that business class was served an 'afternoon tea' complete with champagne (much nicer than the poor Prosecco in the lounge). We had three small sandwiches, chocolate cake and a choice of plain or fruit scone. Strawberry jam and clotted cream on the side for those who wanted them. It all tasted great, I didn't try the chocolate cake, and there was just about enough time to eat it before landing. The crew worked very hard to complete service in time so well done them."
11,"✅ Trip Verified |  Flew British Airways on BA 434 London Heathrow to Amsterdam. I was able to check in at the BA First Class check in area in Terminal 5 and this is very fast and efficient. The lounge was quite busy; however, I was able to find space. The food, snacks, and drinks available was excellent as was the overall service. I also like the BA First Class Check in area as the security clearance is fast. Boarding was a little chaotic, however we boarded on time and the take off runway was close to the departing gate, therefore no delays. The flight itself was quite good as was the cabin crew and the meal service."
12,"✅ Trip Verified |  BA cancelled the flight from Tokyo to LHR. I was booked on next day flight. There was another flight on the same day. I went to the desk, but the flight was full. BA in charge offers another flight through Hong Kong which would have been 26h flight time. I declined that, and asked to stay on the next day flight. To my dismay he cancelled the next day flight without telling me he did that. I think he was annoyed that I didn’t accept the offer after he spent sometime looking for. In fact I am the one who should be annoyed for cancelling my flight. I ended up flying another airline with downgrading. Poor service, and appalling behaviour. You expect better from BA."
13,"✅ Trip Verified | I strongly advise everyone to never fly British Airways. I know we will never do so again. We had business class seats booked for an early morning flight from Heathrow to SF - and then the flight was cancelled the evening before the flight. We luckily checked email before we went to bed and found out it was canceled. We then called BA, and after waiting 30 minutes someone to answer the call, the person who finally did said he was going to move us to a United Air flight leaving an hour later from Heathrow to SF the next day. He told us the flight number and said he had booked us business class seats. It took a long time to get it all worked out, so we got just a few hours sleep that night, but it looked like it was resolved. Then, however, when we got to Heathrow early the next morning we found that the BA person did not complete the booking as needed and United could not give us seats. They said we needed to call BA to get them to complete the change. But despite numerous attempt we could not get anyone to answer the phone at BA. This went on for 2 hours. Finally, by the grace of god, after hours of stress trying to figure out what to do, we found a United ticket agent at the airport who personally called BA for us and got then to fix the problem. So, after being at Heathrow at 7 am, we ended up leaving for SF late that afternoon totally exhausted. The United air ticket agent saved us and allows us to get home. She also said these problems were common with BA. "
14,"✅ Trip Verified | My partner and I were on the BA2166 return flight from Tampa to Gatwick and I was very excited as had paid for a upgrade to Business Class, my partner flies BC with BA a lot for work but this was only my second time, we decided as it was the end of our holiday that have this will help us get some quality sleep. Unfortunately that was not to be. Also in Business Class were two families with children under 5. It was a very long flight listening to a toddler not just crying but screaming for seven out of the eight hours. Now its not the childrens fault, I do however think that the cabin crew could have maybe internvene and helped a little more but also BA should have informed us as we paid alot of money and quite frankly could have saved that money and just had economy ticket as at least we would be a few grand better off. What with that and how the checking in ground staff were treating us as if we were an inconvenience we will rethink BA moving forward."
15,"Not Verified |  We had a Premium Economy return flight Los Angeles to London. The outbound flight was cancelled with under 12 hours notice, and we had to instead take an economy flight via Dublin to London. That's annoying but it happens. What is really difficult to understand is BA's response since I raised this as a claim once our return flight had completed (as I was instructed to do). It is now nearly 5 months and there has been no response other than one in early March with the title ""we've not forgotten your case"" and ""We're really sorry you're still waiting for a response from us. We know it's been a long time since you contacted us and this isn't the service you should expect. Rest assured we've not forgotten your case. Our Customer Relations team are working extremely hard to respond to you as soon as possible. Thank you for your continued patience. You can check the status of your case here. Please accept our most sincere apologies. We look forward to speaking with you soon."" I called about a month ago to enquire and was told i'd be hearing within the week. This is just extremely poor customer service, in addition to the inconvenience and stress of the late-cancelled flight, delays and change in class of flight. British Airways really seems to be on the decline, i have so many friends who are long-time customers like us who are having flights cancelled or delayed with little commitment to make it right. I have been a member of their Flying Club for 20 years, is this how you treat loyal customers BA?"
16,"✅ Trip Verified |  I should like to review my flight with British Airways from Hannover to London Heathrow. Firstly, the website was very easy to use, however, I object to the policy put in place with regards to having to pay for preferred seating. Checking-in online was a very easy process other than being presented with the fee to select a seat. At the boarding gate in Hannover the staff were superb, they insisted that people with larger bags turned over the bags for check-in. I was included in this. The staff were very fair and polite and imposed this policy evenly and in a firm but polite manner. The flight took off reasonably on-time. The cabin crew were very good and coped really well with what was an entirely full flight. The now usual small bottle of water and a tiny snack the size of a UK 50p coin were issued to the passengers. On this flight, the Captain was very vocal in the nicest possible way. He oozed a sense of professionalism and was well spoken with clear and informative announcements. Disembarkation was orderly, however the cabin crew were nowhere to be seen when leaving the aircraft. Given that this was a very short flight and given the full nature of the flight too the cabin crew deserve an applause for their professionalism. This experience has turned around my less than positive experience with this airline a few months ago. Well done to the ground staff and cabin crew for making this a pleasant and civilized journey!"
17,"✅ Trip Verified | We have flown with British Airways a few times but this last trip was by far the worst experience. We weren't able to check in online because the system wouldn't accept any of our passport info, so we had to wait to check in upon arrival at the airport. We arrived two hours before our scheduled departure. The line was backed up with only 4 stations being staffed where there was room for at least 6 more attendants to help expedite check in. We talked to a few people in line and they too were unable to check in online. It took the desk attendants an hour to check in the people ahead of us. We told the agent we had tried to check in online but it wouldn't accept our passports, she replied it was because they need to verify each passport personally. I asked that wouldn't they verify them that way anyway? I also let her know we attempted to move closer to the front of the plane and could see there were seats available but couldn't secure them because we couldn't finish check in. She went on to tell us it's a full flight so we wouldn't be able to choose our seats. We reached the gate and ask the agents there about moving to another section and she confirmed there was no availability. During the flight, the service was not what we expected based on previous flights. We only saw the flight attendants during food service and twice to pickup trash. Every time I went to the lavatory, there were at least 6-8 attendants standing around chatting, instead of taking care of the passengers. The attendants seemed uninterested and inexperienced, even snapping at a confused passenger regarding their seat belt. The flight attendants were disappointing to say the least. No available air control vents above us, so no option to have any air flow other than what the whole plane had. Upon landing, we went to the baggage carousel to claim our bags. An hour later, still no bags. Finally a message came over the loudspeakers that the elevator on the plane was broken and the ETA of the bags was still unknown. About 30 minutes later, the bags started to slowly appear on the belt. Overall, this was the worst BA flight we've experienced."
18,"✅ Trip Verified | I sat in the plane at Vienna airport for three hours and didn't take off. After arriving in London, I was sent on my connecting flight, only to be told that the plane had already closed and that I should go back to the other terminal. I was then flown to Johannesburg with Virgin and when I arrived my luggage had not been taken. I only received it five days later. I have been waiting for compensation for nine months. Never again British Airways"
19,✅ Trip Verified | It is almost 11pm we were supposed to take off at 19.20 we are still sitting on the plane at the airport. The worst part is not the technical issue that has kept us grounded but the fact we have only been offered half a glass of water the entire time we have been on board. Being hungry and dehydrated has not helped the situation.
20,"✅ Trip Verified |  I booked a long haul flight to Singapore with British Airways because I thought I could rely on them to provide good and reliable service. Unfortunately this wasn't the case hence this review. Knowing I would be able to fall asleep watching movies or TV shows on their in flight entertainment system was something I was looking forward to on this overnight flight. However, my console didn't work and instead I had a loud screaming toddler in the seat behind me that kept kicking my seat and some babies in Front. Only two hours into this already hell of a journey were we told that we should buy the WiFi pass for which we will get fully reimbursed. I followed up several times throughout the flight with the cabin crew who assured me they will take a note of my seat number and someone from customer service will contact me with reimbursement. This wasn't the case. After waiting for several days I contacted them myself and instead of the 21.99 reimbursement that I can use towards a nice meal on holiday they've given me 5000 AVIOs. I never want to fly with them again so why give me service points when I was told by cabin crew I would be refunded - the only reason I even bought this WiFi pass as it's not even good enough to watch anything with because the connection quality is so poor. What a waste of a flight and £22. These are 14 hrs of my life I will never get back and forever remember. I will remember BA as the brand that once was that no longer is. Their cabin crew seemed overworked and overwhelmed and even when you pressed the attention buzzer no one came. If you can avoid booking with BA go ahead. "
21,"✅ Trip Verified |  A premium price for a sub-par product - flew BA (031/032) LHR and HKG and return in May. We had originally booked when the aircraft was allocated the club suites - paid for seat selection. A couple of months prior to the trip, the aircraft was changed to the 2/3/2 layout with the yin/yang seat configuration. We had been allocated 2 of the 3 middle seats, so paid again to select the window and aisle. The hard product is poor - the seat space lacks any form of storage that remains accessible when the seat is in the flat position - nowhere to put specs, a book or phone. Additionally, the window seat passenger has to climb over the feet of another passenger to use the toilet etc - really poor layout. The planes on both legs of the journey were tired and shabby. The crew on the outward journey were enthusiastic and helpful - the return crew seemed less adept at managing the service. The outbound catering was acceptable - but the presentation on tiny plates does not compare favourably with competitors. The catering inbound was very poor. The welcome ‘champagne’ was truly awful. This is a poor product at a premium price - and sad to say, this pair of self-funding passengers won’t choose to repeat the experience. The lounge at Heathrow on the outbound sector was packed to the rafters and was a poor experience. Very disappointing."
22,✅ Trip Verified |  Really terrible user experience. British Airways website is full of glitches. I can't even choose my own seat due to cookie problems. Never had this problem with any other airlines. 
